{
  "$schema": "../project.schema.json",
  "id": "mice-pj55",
  "domain": "other",
  "title": "地域のMICE誘致力強化促進事業（PJ_No.55）",
  "subtitle": "伝統的工芸・ものづくりを中核としたMICE推進事業。米沢観光コンベンション協会が申請主体、プラットヨネザワが事務局・PMとして伴走する個社PM。",
  "org": "プラットヨネザワ株式会社",
  "docsUrl": "https://drive.google.com/drive/folders/1j2FpAqBmXyZrFWAUWkNyZuDUjnGZYmMs",
  "hero": {
    "breadcrumb": "個社PM ＞ 米沢観光CV協会 MICE推進事業",
    "badges": [
      { "label": "観光庁 R8補助（採択済）", "kind": "r7" },
      { "label": "進行中（実施計画・交付準備フェーズ）", "kind": "r7" }
    ],
    "metaRow": [
      "📌 事業：観光庁 令和8年度「地域のMICE誘致力強化促進事業」",
      "🤝 申請主体：米沢観光コンベンション協会＋プラットヨネザワ（DMO）＋自治体",
      "🎯 プラットの役割：事務局・PM（事務局中心＝鈴木／統括＝宮嶌）",
      "🗓 運用：週次定例（毎週木 15:30＠米沢観光CV協会）"
    ]
  },
  "live": {
    "phase": "10/13 事務局・観光庁との事前確認ミーティングを実施。総事業費を350万円に再設計した予算変更案とモニターツアー行程案（1泊2日・約20名）を説明し、提出手続き・22項目の確認事項を協議。10月下旬の実施計画書・収支予算書の提出に向けて根拠資料を取りまとめ中",
    "nextMilestone": "10月下旬 実施計画書・収支予算書の提出 → 10〜11月 専門家事前視察 → 12〜1月 モニターツアー本番",
    "nextDeadline": "2026-10-31",
    "progress": 0.7
  },
  "alert": "<strong>🆕 10/13 事務局・観光庁との事前確認ミーティングを実施（オンライン）。</strong>実施計画書・収支予算書の提出に先立ち、<strong>予算変更案・モニターツアー行程案・各プログラムの進め方</strong>を説明し、提出手続きと判断事項（確認事項22項目・うち当日必須10項目）を協議。<strong>同日13:00から山形大学工学部 菅井氏とMICE事業に関する打合せ</strong>を実施。<br><strong>💰 予算変更案：総事業費 3,812,500円 → 3,500,000円（△312,500円）</strong>。観光庁実証事業経費 305万→<strong>280万</strong>／協会自己負担 76.25万→<strong>70万</strong>（自己負担比率20.0%を維持）。<strong>②体験ツアー造成・多言語整備は115万→180万</strong>（モニターツアー造成・実施を100万→<strong>160万</strong>に統合増額、<strong>専門家事前視察20万を新設</strong>＝4名×5万円、展示パネル多言語化15万は協会自己負担へ移管）。<strong>④プロモーション素材は190万→100万</strong>（Web 50万は据置だが制作体制を地元制作者＋DMOへ変更、ガイド40万は冊子印刷をやめ日英2版をPDF納品、<strong>動画は100万→10万</strong>に縮小し縦型を検討）。<strong>⑤協会自己負担は事業PM33万／展示パネル15万／ワイヤレスガイド レンタル27,060円／多言語POP 192,940円</strong>。<br><strong>🚌 モニターツアー行程案（12月〜1月・1泊2日・約20名）</strong>：1日目 13:06米沢駅集合→<strong>古川研究室</strong>（3Dフードプリンター実演・STAR-MEALS）→<strong>東光の酒蔵</strong>見学＋日本酒とモクテルのアペリティフ→ホテル→<strong>上杉伯爵邸で夕食</strong>／2日目 <strong>よねざわ新田</strong>工房見学・紅花染め体験→<strong>粉名屋小太郎</strong>昼食→13:40解散。移動はバス、ワイヤレスガイド（受信機30台・送信機2台）と多言語ガイドが同行。<br><strong>🤝 10/7〜10/9にモニターツアー立ち寄り先とキックオフ打合せを実施（よねざわ新田・東光の酒蔵・黒田三佳氏）。</strong><strong>よねざわ新田</strong>＝紅花染め体験は20名同時でOK（班分け不要・最大25名の実績）、見学は染め場→小物制作→道具類→織り場の順でスタッフが必ず付添い、織り場は5名程度ずつ区切って見学。<strong>東光の酒蔵</strong>＝<span style='color:#b85565'>会長ガイド40〜45分＋買物15〜20分が必要で現行の「見学30分＋アペリティフ30分」では不足</span>し、<strong>酒蔵滞在を＋15〜30分とする行程見直しが必要</strong>。会場は暖房のある<strong>「上段の間」</strong>、飲食は外部持込みをせず<strong>東光商品で完結（梅プラン3,300円＋α）</strong>。<strong>黒田三佳氏</strong>＝東光でのご出演は見送り、<strong>1日目の古川研究室枠（13:30-15:00）でのコラボを第一候補</strong>、上杉伯爵邸の夕食時プレゼン（10分程度）を代替案とする。<span style='color:#b85565'>JAXA（宇宙ガストロノミー構想）との関係で紹介できる範囲は10/13の山形大学との打合せで確認</span>し、結果は10/16(金)までに黒田氏へ共有。<strong>⚠️ 実施可能日の制約</strong>＝<span style='color:#b85565'>東光 12/3〜1/2休業・1〜3月の毎週火曜定休／よねざわ新田 12/24〜1/5・1月第3・4週は受入不可／粉名屋小太郎 月曜定休</span>。<br><strong>🖥 Webは制作体制を変更</strong>：川島印刷→<strong>プラット側（井上陽平氏＋鈴木）で制作</strong>。井上氏見積 <strong>296,000円</strong>（10/5付v1）＋鈴木担当分204,000円＝計上額50万円。サーバー・ドメインは<strong>協会名義への取り直し・汎用ドメインへの変更を検討</strong>。ガイドの翻訳はマリー氏にAI翻訳＋チェックで依頼（28頁×3,000円＝84,000円）。<br><hr><strong>9/10 専門家視察（観光庁事務局 平間氏）。</strong>東光の酒蔵／里山ビジョンハウス／よねざわ新田／三井屋工業／山形大学 古川英光研究室の5か所を視察し、フィードバックを整理（9/14 社内共有）。<strong>古川研究室は「キラーコンテンツ」「先生に会うためだけでも海外企業が来る理由になる」と最高評価</strong>／新田は会長の説明が高評価だが<strong>英語対応と多言語パネル化が課題</strong>／東光の酒蔵は<strong>ユニークベニュー（夕食会場）として有力</strong>／里山ビジョンハウスは世界観・体験の独自性が高評価だが<strong>冬季プログラム設計が課題</strong>／<strong>三井屋工業は一般向けには専門性が高く、一般向けツアーからは除外し業界特化型へ</strong>。<br><strong>🔁 FAMツアーの方針が転換</strong>：平間氏の助言により<strong>初年度は国際会議系・インセンティブ系を分けず「1回にまとめて実施」</strong>、時期は<strong>12〜1月</strong>（11月はエージェント繁忙期）、<strong>1泊2日・米沢駅14時台集合</strong>。モデルコース＝1日目 古川研究室→東光の酒蔵でユニークベニュー夕食→宿泊／2日目 よねざわ新田→里山ビジョンハウス出張コラボランチ＋プレゼン→13時解散。<strong>9/28にFAMツアー準備シート（準備工程表・当日タイムテーブル・訪問先調整リスト・参加者内訳の4シート）を作成</strong>。<br><strong>💰 予算の考え方が明確化</strong>：<strong>支援経費は自己負担額の最大4倍（自己負担比率20%がミニマム）</strong>。事前視察は事業経費に計上可で<strong>本番の1〜2ヶ月前（例：12月頭本番なら10月頃）が推奨</strong>（専門家2名＋事務局1名＋観光庁1名が目安）。写真撮影は観光庁のカメラマン派遣制度あり。予算配分は<strong>①FAMツアー本体を最優先 → ②残予算でプロモーション施策</strong>の順。<br><strong>📝 9/16 定例で予算・発注方針を大幅見直し。</strong>川島印刷の見積（<strong>ガイド 319,770円／HP制作 715,000円／HP年間維持 46,200円</strong>・すべて税込）を受け、<strong>①モニターツアー予算を6/23時点の当初申請額に近い水準へ戻して再設計</strong>（東京から専門家招聘の実費は1人あたり6〜7万円程度／自己負担増加分は約70万円の還元で対応）、<strong>②HPリニューアルはフロントデザイン＝井上氏夫妻・コーディング＝鈴木の体制とし概算50万円を目安に再見積</strong>（デザイン費・コーディング費・サーバー代の内訳を明記）、<strong>③ガイド冊子は施設情報を削減し支援内容・エクスカーションを充実させ28ページ程度に圧縮（日英2言語）・印刷せずPDF納品を打診</strong>、<strong>④プロモーション動画は一旦取りやめ、スマホ撮影の縦型動画で代替し浮いた予算をweb費へ振替</strong>。ヘッドセット等の備品費・多言語パネル制作費は個数を精査して見積を取り直す。サーバー・ドメイン契約は<strong>協会名義への移管</strong>を検討。",
  "tabs": [
    { "key": "overview", "label": "📌 概要" },
    { "key": "milestones", "label": "🎯 マイルストーン" },
    { "key": "tasks", "label": "📋 タスク・担当" },
    { "key": "deps", "label": "🔗 依存・リスク" },
    { "key": "mtg", "label": "📝 MTG・資料" }
  ],
  "sections": [
    {
      "type": "highlight", "tab": "overview", "title": "事業概要", "icon": "📌",
      "html": "観光庁 令和8年度<strong>「地域のMICE誘致力強化促進事業」</strong>を活用し、置賜紬などの<strong>伝統的工芸×先端ものづくり</strong>を中核に据えた米沢型MICE（小規模会議・インセンティブ・エキシビション）の誘致力を強化する事業。<strong>申請主体＝(一社)米沢観光コンベンション協会＋米沢市版DMO プラットヨネザワ＋自治体</strong>の3者連携。プラットヨネザワは<strong>事務局・PM</strong>として、交付申請・見積一括取得・体験ツアー造成・多言語対応・プロモーション素材制作・受入態勢整備までを一気通貫で伴走する。補助率<strong>4/5（自己負担1/5）</strong>。なお本事業は補助事業ではなく<strong>観光庁の実証調査事業</strong>で、経費は実証の実施に必要な範囲が対象（耐久消費財の取得は経費対象外／7/22 事務局メール回答）。"
    },
    {
      "type": "stats", "tab": "overview",
      "items": [
        { "number": "350", "numberStyle": "font-size:1.4rem;", "unit": "万円", "label": "総事業費 変更案（観光庁280万＋自己負担70万／10/13 提出前確認）" },
        { "number": "4/5", "unit": "補助率", "label": "自己負担1/5（余剰金等が原資）" },
        { "number": "採択", "numberStyle": "font-size:1.4rem;", "unit": "済", "label": "観光庁 R8（実施計画準備フェーズ）" },
        { "number": "週次", "numberStyle": "font-size:1.4rem;", "unit": "定例", "label": "毎週木15:30／全体計画確定後は月1へ" }
      ]
    },
    {
      "type": "table", "tab": "overview", "title": "実施プログラム ポートフォリオ", "icon": "🏗",
      "heading": "実証対象は②・④（7/28事務局定例／勉強会・海外出展者誘致は対象外）。10/13 提出前確認MTGの予算変更案＝総事業費350万円（観光庁280万＋協会自己負担70万・自己負担比率20.0%）",
      "head": ["#", "プログラム", "主な内容", "予算（変更案）", "状態"],
      "rows": [
        ["②", "<strong>サステイナブルものづくり体験ツアー造成・多言語対応整備</strong><br><small>モニターツアー造成・実施（20名・1泊2日×1回）／専門家事前視察／多言語ガイド・ワイヤレスガイド</small>", "体験ツアー造成＋多言語", "<strong>180万円</strong>（115万→＋65万）<br><small>ツアー160万／事前視察20万</small>", "行程案提示・受入先調整中"],
        ["④", "<strong>プロモーション素材・情報発信</strong><br><small>多言語MICEポータル(Web)・米沢コンベンションガイド(日英PDF)・プロモーション動画(縦型)</small>", "広報・営業ツール整備", "<strong>100万円</strong>（190万→△90万）<br><small>Web50万／ガイド40万／動画10万</small>", "見積取得・仕様協議中"],
        ["⑤", "<strong>受け入れ態勢整備（協会自己負担）</strong><br><small>事業PM(事務費)・展示パネル多言語化(5施設)・ワイヤレスガイドのレンタル・多言語POP(酒蔵/米織工房)</small>", "受入体制・PM", "<strong>70万円</strong>（76.25万→△6.25万）<br><small>PM33万／パネル15万／ガイド機材27,060円／POP192,940円</small>", "自己負担で実施"],
        ["共通", "<strong>引き継ぎ・事務局運営</strong><br><small>交付申請書類・予算確定・見積一括取得体制・OneDrive権限・名刺デジタル化・資金繰り</small>", "事務局基盤", "事務費(全体10%以内)", "進行中"]
      ]
    },
    {
      "type": "table", "tab": "overview", "title": "モニターツアー 受入先 調整状況", "icon": "🤝",
      "heading": "10/7〜10/9に各受入先とキックオフ打合せを実施（議事録は Drive「20_外部とのやりとり」の施設別フォルダ）",
      "head": ["受入先", "受入内容", "主な合意事項", "受入不可期間・制約"],
      "rows": [
        ["<strong>よねざわ新田</strong><br><small>10/7 キックオフ（新田真有美様）</small>", "工房見学＋紅花染め体験（2日目）", "<strong>紅花染め体験は20名同時でOK</strong>（最大25名の実績）・班分けせず20名同時進行／見学動線は染め場→小物制作→道具類→織り場、順路サインは設置せずスタッフが必ず付添い（会長ガイド＋1〜2名）／<strong>織り場（2F）は大人数不可のため5名程度ずつ区切って見学</strong>／解説はその時の作業に合わせたライブ解説／階段の滑り防止で<strong>スリッパなし</strong>／体験後はビニール袋で持ち帰り（日英の取説あり）", "<span style='color:#b85565'>12/24〜1/5、1月の第3・4週は受入不可</span>／免税対応なし／<strong>中型バス乗入れOK</strong>"],
        ["<strong>東光の酒蔵</strong><br><small>10/8 キックオフ（小嶋彌左衛門様・小嶋淳子様）</small>", "酒蔵見学＋日本酒とモクテルのアペリティフ（1日目）", "<span style='color:#b85565'>見学30分＋アペリティフ30分では不足</span>。会長ガイド40〜45分＋買物15〜20分を踏まえ<strong>酒蔵滞在を＋15〜30分に行程見直し</strong>／会場は冬季の寒さを考慮し<strong>今回に限り「上段の間」</strong>（暖房可）／<strong>外部ケータリング・モクテルの持込はせず東光の商品で完結</strong>＝<strong>梅プラン（3,300円税込・日本酒3種＋おつまみ3種＋梅酒ロック）＋α</strong>（甘酒・梅ソーダ・紫蘇ジュース等）で価格設定／<strong>古川教授の同席OK</strong>／撮影は東光と分かる構図・クレジット表記", "<span style='color:#b85565'>12/3〜1/2 年末年始休業、1〜3月は毎週火曜定休</span>／通常営業は16:30まで（時間外対応は可）／免税対応不可"],
        ["<strong>黒田三佳様（里山ビジョンハウス）</strong><br><small>10/9 キックオフ</small>", "「かてもの」モクテル提供＋里山プレゼンテーション", "<strong>東光の酒蔵での出演は見送り</strong>（時間・スペースの制約／東光のノンアル商品で対応）／<strong>第一候補＝1日目 古川研究室枠（13:30-15:00）でのコラボ</strong>（3Dフードプリンター実演の合間にモクテル＋おつまみを提供）／<strong>代替案A＝上杉伯爵邸の夕食時に10分程度のプレゼン</strong>（黒田様「一番よさそう」・未打診）／代替案B＝粉名屋小太郎 昼食（課題多く優先度低め）／プレゼンは機材不要の<strong>資料配布形式（URL共有が最有力）</strong>", "<span style='color:#b85565'>JAXAの制約</span>：宇宙ガストロノミー構想と「かてもの」を組み合わせると構想の一部に見えるおそれがあり許可が必要／里山ビジョンハウスでの昼食は冬季の積雪・冬季休業・収容20名限界のため今回は見送り"]
      ]
    },
    {
      "type": "text", "tab": "overview", "title": "プロジェクト体制", "icon": "🤝",
      "heading": "推進体制（プラット＝事務局・PM／協会＝主体的関与）",
      "html": "<strong>プラットヨネザワ</strong>＝事務局・PM・書類作成／見積一括取得・発注（再委託にしない）／体験ツアー造成・多言語・プロモ素材の企画。<strong>宮嶌 浩聡</strong>＝全体統括・担当役員（副会長）。<strong>鈴木 美由紀（本PJTオーナー）</strong>＝MICE事務局中心（週2勤務）・書類/見積・バックオフィス・WBS管理。<strong>石山 杏子</strong>＝通訳ガイド育成の主担当。<strong>井上 陽平</strong>＝作業リストのWBS化。<br><strong>米沢観光コンベンション協会</strong>＝申請主体・意思決定・行政/事務局との窓口。<strong>青木 一成氏</strong>（事務局長）＝官公庁・事務局対応・予算/資金繰り。<strong>五十嵐 真琴氏</strong>（ビューロー担当）＝通常事業(学会誘致)・引き継ぎ。<strong>佐藤 道代氏</strong>＝前任(11年)・引き継ぎ。<strong>JTB 平間氏</strong>＝予算書・備品数量の相談パートナー。"
    },
    {
      "type": "table", "tab": "overview", "title": "事業の狙い（趣意書より）", "icon": "🎯",
      "head": ["柱", "内容"],
      "rows": [
        ["受入環境の高付加価値化", "ユニークベニュー開発・体験プログラム造成・食の整備・歓迎装飾/備品（工場見学時の騒音対策イヤホンマイク等）"],
        ["広域連携・エクスカーション", "周辺MICE（福島市等）と連携し米沢への来訪機会を創出。広域受入体制を構築"],
        ["意識向上・推進体制", "MICE経済波及効果の数値共有（山形市 R6=17億円／米沢市 R7=4千万円）・専門アドバイザー招請・山形大学工学部と誘致チーム構築"],
        ["MIEへの展開", "C(会議)に加えI(インセンティブ)・E(エキシビション)へ拡大。台湾グローバル企業招請による商談会も視野"]
      ]
    },
    {
      "type": "gantt", "tab": "milestones", "title": "統合タイムライン（ガント）", "icon": "📊",
      "heading": "実施計画づくり〜実働〜報告（2026/10/13時点）",